id,handle,title,date_issued,uri,doi,citation,type,centre,publisher,api_url,authors,language,openaccess,discoverable,govdocnum,isbn,program,project,contact,catn,bbox,polygon,sponsor_code,workflowid,abstract
aa545327-1491-4f8f-b9dd-cd171e4d759d,1845/160590,"Bedrock and surficial geology of the Maritime Provinces",2011-01-01,https://ostrnrcan-dostrncan.canada.ca/entities/publication/aa545327-1491-4f8f-b9dd-cd171e4d759d,https://doi.org/10.4095/287939,"Goodwin, T. A. (2011). Bedrock and surficial geology of the Maritime Provinces. In Rencz, A. N. & Kettles, I. M. (eds.), <i>Presentations and recommendations from the workshop on the role of geochemical data in environmental and human health risk assessment, Halifax, 2010</i>, <i>Geological Survey of Canada, Open File</i>, 6645, 13-15. Natural Resources Canada. https://doi.org/10.4095/287939",Report,"GSC-Northern Canada","Natural Resources Canada",https://ostr-backend-prod.azurewebsites.net/server/api/core/items/aa545327-1491-4f8f-b9dd-cd171e4d759d,"Goodwin, T. A.",English,green,1,,,"Environmental Geoscience","Ecosystems Risk Characterization",,,"ENVELOPE( -70.0000,  -52.0000,   53.0000,   43.0000)","POLYGON((46.0000 -52.0000, 43.0000 -66.0000, 47.0000 -70.0000, 49.0000 -64.0000, 53.0000 -54.0000, 46.0000 -52.0000))",GE1002,,"The oldest rocks in the Maritimes belong to the Blair River Complex, a small pocket of Proterozoic rocks located in the northwestern edge of Cape Breton Island, Nova Scotia. These rocks include high-grade metamorphic gneiss, schist, amphibolite and associated granitoidintrusions associated with the Grenville Orogeny. The rocks of the Grenville Orogen represent the southeastern margin of the Canadian Shield, and were accreted or welded onto the Canadian Shield about 1 billion years ago during the formation of the paleo-supercontinent of Rodinia. One continent thatresulted from the breakup of Rodinia was Laurentia, the original ""core"" of the North America, surrounded by oceans including Iapetus. During the Ordovician to early Carboniferous interval, several Early Paleozoic and older terranes were accreted to Laurentia in the Appalachian Orogen.From west to east these include several terranes related to the Iapetus Ocean, Ganderia, Avalonia, and Meguma. Today, remains of the Orogen and its constituent terranes extend from Newfoundland through Nova Scotia, Prince Edward Island, and New Brunswick, along the eastern seaboard of the UnitedStates to Florida. They also connect across the Atlantic Ocean with the Caledonian Orogen of Greenland, northwestern British Isles and Scandinavia. Ganderia consists dominantly of Precambrian and Cambrian sedimentary and volcanic rock assemblages. The accretion of Ganderia onto Laurentia occurredapproximately 430 million years ago and resulted in the closure of the Iapetus Ocean. Rocks associated with Ganderia occur today in central New Brunswick, western Prince Edward Island and western Cape Breton Island.The accretion of the Avalon Terrane onto the southern margin of Ganderia occurred approximately 400 million years ago. Volcanic rocks of Avalonia are located along the southern margin of New Brunswick, as well as northern mainland Nova Scotia and the eastern half of Cape Breton Island. The finalAppalachian terrane to accrete was Meguma, the most outboard terrane in the Canadian Appalachian orogen and found onshore only in southern Nova Scotia. The Meguma Terrane accreted to Avalonia approximately 390 million years ago and consists of Cambro-Ordovician metasediments. Meguma rocks displaymany similarities to rocks currently found in northern Africa (Morocco). Major structures formed during the accretion of the Appalachian terranes include the Caledonia Fault Zone that separates Ganderia from Avalonia in southern New Brunswick and the Cobequid-Chedabucto Fault Zone that separates theMeguma to the south from the Avalonia to the north. Magmatism occurred in association with the accretion of terranes and Appalachian mountain building. One example, the South Mountain Batholith, is the largest exposed intrusion in the Appalachian Orogen, and is associated with the closure of theRheic Ocean, which separated Meguma from Gondwana, about 380 million years ago. As collisions that created the Appalachian Orogen ended, a complex series of fault-bounded basins and uplands developed called the Maritimes Basin. The subbasins (generally called basins) of the Maritimes include theMoncton Basin, Stellarton Basin and the Sydney Basin. Uplands included the Caledonia Highlands, Cobequid Highlands, Antigonish Highlands and the Cape Breton Highlands. During latest Devonian and earliest Carboniferous time, the basins were filled with Horton Group sediments sourced from the erodingupland ranges by large, extensive river systems and lakes. The basins were subsequently inundated by transgressive and regressive cycles associated with the Windsor Sea beginning approximately 340 million years ago. Deposition of Windsor Group carbonates, evaporates and siliciclastic sedimentaryrocks occurred during this much drier climatic period. Approximately 325 million years ago (late Carboniferous) the Windsor Seas regressed for the last time, the climate became relatively wetter and the Maritimes were once again subjected to large terrestrial rivers (and floodplains) that resultedin the deposition of thick siliciclastic sedimentary rocks of the Mabou and Cumberland groups until about 305 million years ago. During this roughly 20 million year time period, lush vegetation associated with aerially extensive rainforests and swamps were the precursor to the significant coaldeposits (Sydney, Springhill, Stellarton) of the Maritime Provinces. During the Permian, approximately 250 to 290 million years ago, the climate changed once again but this time included some very dry conditions to form the distinct red rocks of Prince Edward Island and northern mainland NovaScotia. Approximately 230 million years ago Pangea started to rift apart and about 200 million years ago the pieces began to drift apart. In Nova Scotia, the drifting is indirectly heralded by a major volcanic event that resulted in the formation of the North Mountain basalt around what is today theBay of Fundy (which coincidently forms the northern margin of the Annapolis Valley) as well as basalt exposures at Five Islands, Wasson Bluff and Partridge Island along the north shore of Cobequid Bay, Nova Scotia, and Grand Manan Island, New Brunswick. The drifting created the Atlantic Ocean, whosemargins became the locus of deep sedimentary basins subsequently in-filled with siliciclastic sediments. Deposition of thin deposits of red sandstones and mudstones immediately post-date eruption and deposition of the basalt. On onshore Nova Scotia for the remaining 200 million years until thepresent, there is very little evidence preserved in the rock record of much activity except for the development of some sand and mud deposits associated with rivers and lakes approximately 100 - 125 million years ago during the early Cretaceous. Most of the surficial glacial deposits and associatedlandforms throughout the Maritimes were formed during Wisconsinan glaciation (Pleistocene) in the last 100 000 years which includes the ""recent"" Holocene. Several local ice centers, collectively referred to as the Appalachian Glacier Complex, were sufficiently large enough to withholdadvancement of the continental Laurentide ice sheet. Throughout the Wisconsian, the ice centers were very dynamic which resulted in a very complex ice flow history for the Maritime Provinces. Reconstruction of the ice flow history of the Maritimes has established a link between ice flow patternsonshore and ice margin terminal moraines offshore.The oldest observed Wisconsinan ice flow indicators are associated with the Caledonia Phase occurring approximately 70 000 to 65 000 years ago. Ice flow was towards the east and southeast likely emanating from the Notre Dame Mountains Ice Divide. The Escuminac Phase occurred approximately 24 000 to20 000 years ago and resulted in south and southwest flow associated with the east-west trending Escuminac Ice Divide situated in central northern New Brunswick extending to the north of Prince Edward Island. Ice flow to the north of the divide was characterized by ice streams into the Bay ofChaleurs and into the Gulf of St. Lawrence. The Scotian Phase occurred approximately 20 000 to 17 000 years ago and was characterized by the mobile Scotian Ice Divide situated over mainland Nova Scotia and the Central Northern Maine Ice Divide along the margin of western New Brunswick. In NovaScotia, this resulted in complex ice flow movement to the north and south as well as southwesterly flow associated with ice streaming into the Bay of Fundy. For New Brunswick, flow was dominantly to the east-northeast during this time period. Final deglaciation commenced approximately 15 000 yearsago with the Chignecto Phase. During this time, glacial ice was likely centered over Prince Edward Island with another smaller ice divide (Fundy Highlands Ice Divide) located in New Brunswick along the northern margin of the bay of Fundy. Remnant ice was thinning and beginning to retreat back fromthe Scotia Shelf and along the margins of the Bay of Fundy. Ice-dammed lakes likely existed in the St. John River Valley in New Brunswick and Glacial Lake Shubenacadie in Nova Scotia. The Collins Pond Phase, however, was the final phase of glacier formation and likely involved expansion of local icecenters in response to a short-lived period of climatic cooling lasting approximately 1000 years during the Younger Dryas Chronozone around 11 000 years ago. Since the Younger Dryas, ice continued to recede andthe Maritimes have been ice free for several thousand years. Various multiple-flow directional indicators, the result of shifting ice centers, have been mapped and are evidence that the Maritimes was characterized by a relatively complex ice flow history. The complex ice flow history of the MaritimeProvinces has, locally, resulted in superimposed till sheets including palimpsest landforms. The surficial geology of the Maritime Provinces is highly variable and includes large areas of variable thick ground moraine and associated streamlined landforms, glaciofluvial deposits (outwash fans anddeltas, valley trains, kames and eskers) as well as glaciolacustrine and glaciomarine deposits. Post glacial (Holocene) sediments include alluvial, colluvial, organic and marine deposits.Enrichment of elements reflecting the bedrock geology is characteristic of many of the surficial deposits throughout the Maritimes. These elements are commonly enriched in soil down ice from their bedrock sources (including zones of mineralized bedrock); the result of mechanical dispersal (erosion,transportation and deposition) by advancing glacial ice. Glacial dispersal distances vary but are commonly hundred's of meters to several kilometres down-ice from source. The diversity of the Maritime bedrock and surficial geology has yielded a wide array of mineral resources that have been exploited for centuries. Archaeological evidence to support this include clay pots, agate and slate tools and scrapers as well as hematitic paints for decorating skin and burialceremonies used by the Mi'kmaq.With the arrival of Europeans, exploitation of coal, iron, manganese and gypsum began. Coal was initially mined in Minto, New Brunswick, in the early to mid 1600's and later that century from Cape Breton. Exploration for other energy related commodities has resulted in the discovery ofnatural gas around Sussex, New Brunswick, as well as oil and gas fields off the coast of Nova Scotia. Iron mining commenced in 1825 in Torbrook and Bridgeville, Nova Scotia. Windsor Group evaporates are the source rock for many of the salt (Napan, Pugwash), potash (Sussex) and gypsum (Milford) minesin the Maritime Provinces. Windsor Group carbonates are used for agricultural purposes and as a primary ingredient in the production of cement. Base metals have been mined from volcanic rocks in Bathurst, New Brunswick, as well as from carbonates in Gays River and Walton, Nova Scotia. Walton wasalso a significant barite producer in the 1950's. Granitic rocks have seen limited production of tin at East Kemptville, Nova Scotia, tin-tungsten at Mount Pleasant, New Brunswick, tungsten at Burnt Hill Brook, New Brunswick, and antimony at Lake George, New Brunswick. The Meguma Terrane ofsouthern Nova Scotia has produced in excess of 1 million ounces of gold mostly from quartz veins associated with deformed sedimentary rocks. Significant gold mineralization also occurs at Clarence Stream, New Brunswick.Early Cretaceous silica and sand deposits are currently being exploited near Upper Musquodoboit and Shubenacadie, Nova Scotia, and Cassidy Lake near Sussex, New Brunswick. The melting of glaciers resulted in the deposition of extensive deposits of waterlaid sediments that are currently beingexploited as sand and gravel deposits throughout the Maritimes. Dimension stone used in the construction of building interiors/exteriors, rock walls, sidewalks, foundations and gravestones has been extensively mined from abundant quarries throughout the Maritimes. Crushed stone from igneous andmetamorphic rock is quarried for high quality construction aggregate used in products such as Portland cement concrete and asphalt."
1e894747-f6a4-4d1d-b09d-a4bcf367decc,1845/246945,"Mapping wildfire and clearcut harvest disturbances in boreal forests with Landsat time series data",2011,https://ostrnrcan-dostrncan.canada.ca/entities/publication/1e894747-f6a4-4d1d-b09d-a4bcf367decc,https://doi.org/10.1016/j.rse.2011.01.022,"Schroeder, T.A.; Wulder, M.A.; Healey, S.P.; Moisen, G.G. 2011. Mapping wildfire and clearcut harvest disturbances in boreal forests with Landsat time series data. Remote Sensing of Environment 115(6): 1421-1433",Article,"Pacific Forestry Centre",,https://ostr-backend-prod.azurewebsites.net/server/api/core/items/1e894747-f6a4-4d1d-b09d-a4bcf367decc,"Schroeder, T. A.; Wulder, M.; Healey, S. P.; Moisen, G. G.",English,open,1,,,,,,,,,,,"Information regarding the extent, timing and magnitude of forest disturbance are key inputs required for accurate estimation of the terrestrial carbon balance. Equally important for studying carbon dynamics is the ability to distinguish the cause or type of forest disturbance occurring on the landscape. Wildfire and timber harvesting are common disturbances occurring in boreal forests, with each having differing carbon consequences (i.e., biomass removed, recovery rates). Development of methods to not only map, but distinguish these types of disturbance with satellite data will depend upon an improved understanding of their distinctive spectral properties. In this study, we mapped wildfires and clearcut harvests occurring in a Landsat time series (LTS) acquired in the boreal plains of Saskatchewan, Canada. This highly accurate reference map (kappa = 0.91) depicting the year and cause of historical disturbances was used to determine the spectral and temporal properties needed to accurately classify fire and clearcut disturbances. The results showed that spectral data from the short-wave infrared (SWIR; e.g., Landsat band 5) portion of the electromagnetic spectrum was most effective at separating fires and clearcut harvests possibly due to differences in structure, shadowing, and amounts of exposed soil left behind by the two disturbance types. Although SWIR data acquired 1 year after disturbance enabled the most accurate discrimination of fires and clearcut harvests, good separation (e.g., kappa ≥ 0.80) could still be achieved with Landsat band 5 and other SWIR-based indices 3 to 4 years after disturbance. Conversely, minimal disturbance responses in near infrared-based indices associated with green leaf area (e.g., NDVI) led to unreliably low classification accuracies regardless of time since disturbance. In addition to exploring the spectral and temporal manifestation of forest disturbance types, we also demonstrate how Landsat change maps which attribute cause of disturbance can be used to help elucidate the social, ecological and carbon consequences associated with wildfire and clearcut harvesting in Canadian boreal forests."
578646c7-730e-4dcd-8ff4-d68e42607523,1845/151208,"Terrestrial Ecozones (forests)",2010-12-31,https://ostrnrcan-dostrncan.canada.ca/entities/publication/578646c7-730e-4dcd-8ff4-d68e42607523,https://doi.org/10.4095/300910,"Atlas of Canada (2010). Terrestrial Ecozones (forests) (6 ed.). <i>Atlas of Canada, Reference Map Series</i>, 6401, Natural Resources Canada. https://doi.org/10.4095/300910",Map,"The Atlas of Canada","Natural Resources Canada",https://ostr-backend-prod.azurewebsites.net/server/api/core/items/578646c7-730e-4dcd-8ff4-d68e42607523,,"English; French",green,1,,,,,,,"ENVELOPE(-141.0000,  -50.0000,   90.0000,   41.7500)","POLYGON((41.7500 -83.0000, 49.0000 -95.0000, 49.0000 -122.0000, 48.0000 -124.0000, 52.0000 -132.0000, 60.0000 -141.0000, 90.0000 -141.0000, 82.0000 -60.0000, 78.0000 -74.0000, 46.0000 -50.0000, 43.0000 -60.0000, 41.7500 -83.0000))",,,"Ecozones are broad ecological zones on the earth's surface and cover a large range of ecosystems such as temperate forest, mountain ranges, grassland, taiga, arctic tundra, extensive river systems, coastline and farmlands. Each ecozone has its own climate, relief, soil,fauna and flora and distinct human activities. In Canada, there are 20 ecozones, consisting of 15 terrestrial and 5 marine units. Forests of Canada cover in total about nine ecozones."
271c06b6-10e7-490e-beec-6ea245c0296d,1845/247424,"Fifty-seven years of composition change in the eastern boreal forest of Canada",2010,https://ostrnrcan-dostrncan.canada.ca/entities/publication/271c06b6-10e7-490e-beec-6ea245c0296d,,"Gauthier, S.; Boucher, D.; Morissette, J.L.; De Grandpré, L. 2010. Fifty-seven years of composition change in the eastern boreal forest of Canada. Journal of Vegetation Science 21: 772-785.",Article,"Laurentian Forestry Centre",,https://ostr-backend-prod.azurewebsites.net/server/api/core/items/271c06b6-10e7-490e-beec-6ea245c0296d,"Gauthier, S.; Boucher, D.; Morissette, J. L.; De Grandpré, L.",English,,1,,,,,,,,,,,"Question: In the boreal forest of eastern Canada, how does forest vegetation change in the sustained absence of fire?  Location: Eastern boreal forest in Quebec’s North Shore region, Canada (49°30'–50°00'N; 67°30'–68°35'W).  Methods: Aerial photos from three different periods (1930, 1965 and 1987) were used to characterize changes in vegetation composition in 23 scenes of 200 ha. Time since fire, presence of secondary disturbances and data on soil and topographic variables were obtained. Ordination and clustering techniques were used to define compositional trajectories of change over the 57-yr period. These trajectories were further grouped into pathways based on compositional changes, time since fire and preferential deposit-drainage types.  Results: Among the 26 compositional trajectories, three successional pathways were distinguished. Two start post-fire succession with a dominance of intolerant hardwood. In one of these, this is followed by an increase in Abies balsamea, while in the second the importance of Picea mariana increases with time. In the third pathway P. mariana is an important component from the outset. In this pathway, we observed modest fluctuation in the relative dominance of P. mariana and A. balsamea and variation in stand structure.  Conclusion: The boreal forest vegetation of Eastern Canada is diverse and dynamic even in the absence of fire, notably under the influence of partial disturbances. Such disturbances can be associated with changes in composition or stand structure. The development of management strategies aimed at maintaining stand diversity by emulating a broader variety of partial and secondary disturbances should be encouraged."
19dd21ff-f739-4a0c-bd8d-90fcbb3b3c86,1845/247449,"Dead wood is buried and preserved in a Labrador boreal forest",2010,https://ostrnrcan-dostrncan.canada.ca/entities/publication/19dd21ff-f739-4a0c-bd8d-90fcbb3b3c86,,"Moroni, M.T.; Hagemann, U.; Beilman, D.W. 2010. Dead wood is buried and preserved in a Labrador boreal forest. Ecosystems 13: 452-458.",Article,"Atlantic Forestry Centre",,https://ostr-backend-prod.azurewebsites.net/server/api/core/items/19dd21ff-f739-4a0c-bd8d-90fcbb3b3c86,"Moroni, M. T.; Hagemann, U.; Beilman, D. W.",English,open,1,,,,,,,,,,,"Large amounts (36.4 Mg ha-1 or 179 m3 ha-1) of buried dead wood were found in overmature (146-204-year-old) black spruce (Picea mariana (Mill.) B.S.P.) forests in the high boreal region of eastern Canada. Amounts of this size indicate that burial reduces rates of wood decay producing an important component of long-term carbon (C) storage. Radiocarbon-derived ages of black spruce stems buried near the bottom of the organic soil horizon at three old-growth sites were up to 515 years old. Together with information on current stand age, this suggests that the stems have been dead for more than 250 years. Most aboveground dead wood decays or becomes fragmented within about 70 years of tree death in these forests. The presence of old yet well-preserved buried wood suggests that decay rates are greatly reduced when downed dead wood is quickly overgrown by moss. Thus, the nature and type of ground-layer vegetation influences the accumulation of organic matter in these forests. This process of dead wood burial and the resultant addition to a large and long-enduring belowground C pool should be considered when estimating dead wood abundance for habitat or forest C accounting and cycling."
0658b14e-1280-409c-9673-e6fa4ccd3e52,1845/218634,"Hydrologic effects of mountain pine beetle infestation and salvage-harvesting operations",2009,https://ostrnrcan-dostrncan.canada.ca/entities/publication/0658b14e-1280-409c-9673-e6fa4ccd3e52,,"Rex, J.; Dubé, S. 2009. Hydrologic effects of mountain pine beetle infestation and salvage-harvesting operations. Natural Resources Canada, Canadian Forest Service, Pacific Forestry Centre, Victoria, BC. Mountain Pine Beetle Working Paper 2009-05. 44 p.",Report,"Pacific Forestry Centre",,https://ostr-backend-prod.azurewebsites.net/server/api/core/items/0658b14e-1280-409c-9673-e6fa4ccd3e52,"Rex, J.; Dubé, S.",English,open,1,,978-1-100-13139-9,,,,,,,,,"The mountain pine beetle (Dendroctonus ponderosae Hopkins) epidemic is changing British Columbia's forests and watersheds at the landscape scale. Watersheds with pine-leading stands may experience changes in their water balance once the pines die. Forestry stakeholders in the Vanderhoof Forest District have reported an increase in groundwater storage. They report a replacement of summer ground (dry, firm soil) with winter ground (wetter, less firm soil), upon which operation of forestry equipment is difficult or impossible before freeze-up. This project was developed to identify a set of risk indicators to predict the risk of summer-ground loss at the watershed level within the Vanderhoof Forest District and others. Risk indicators were selected from available GIS information, aerial photographs, and local knowledge. To make these indicators operationally applicable in forest planning, general information such as watershed aspect, slope, soil type, and others were used. Indicators were selected during an iterative process that included model refinement, prediction, and field verification over a two-year period and a post-hoc assessment of field information to select the indicators that explain most data variability. The most effective indicators for predicting the risk of wet-ground areas at the watershed level were found to be lodgepole pine content, understorey, drainage density, sensitive soils, and the topographic index, all of whose values are available from provincial databases."
