id,handle,title,date_issued,uri,doi,citation,type,centre,publisher,api_url,authors,language,openaccess,discoverable,govdocnum,isbn,program,project,contact,catn,bbox,polygon,sponsor_code,workflowid,abstract
0622e71e-d313-4d1b-9fe4-e1852043592c,1845/224661,"TRIPLEX: a generic hybrid model for predicting forest growth and carbon and nitrogen dynamics",2002,https://ostrnrcan-dostrncan.canada.ca/entities/publication/0622e71e-d313-4d1b-9fe4-e1852043592c,,"Peng, C.; Liu, J.; Dang, Q.; Apps, M.J.; Jiang, H. 2002. TRIPLEX: a generic hybrid model for predicting forest growth and carbon and nitrogen dynamics. Ecological Modelling 153: 109-130.",Article,"Pacific Forestry Centre",,https://ostr-backend-prod.azurewebsites.net/server/api/core/items/0622e71e-d313-4d1b-9fe4-e1852043592c,"Peng, C. H.; Liu, J.; Dang, Q.; Apps, M. J.; Jiang, H.",English,open,1,,,,,,,,,,,"To predict the potential effects of future global environmental changes (e.g. climate, land-use, fire disturbance, and forest harvesting) on the sustainability of forest ecosystems, forest resource managers will need forest simulation models. Basic approaches to modelling forest growth and dynamics include the use of empirical, mechanistic, and hybrid forest simulation models. In this paper, a hybrid, monthly time-step model of forest growth and carbon dynamics (TRIPLEX) is described and tested. The TRIPLEX model integrates the forest production model of 3-PG (For. Ecol. Manage. 95 (1997) 209), the forest growth and yield model of TREENYD3 (Ecol. Model. 90 (1996) 187), and the soil–carbon–nitrogen model of CENTURY4.0 (Global Biogeochem. Cycles 7 (1993) 785). The model is intended to be comprehensive without becoming complex, and minimizes the number of input parameters required, while capturing key processes and important interactions between the carbon and nitrogen cycles of forest ecosystems. It is designed as a hybrid of both empirical and mechanistic components that can be used for (1) making forest management decisions (e.g. growth and yield prediction), (2) quantifying forest carbon budgets, and (3) assessing the effects of climate change in both the short and long term. We tested TRIPLEX against age-dependent growth measurements from 12 permanent sample plots (PSP) in jack pine (Pinus banskiana Lamb.) stands in northern Ontario (Canada). Comparisons of simulated stand growth variables (e.g. tree diameter, height, and stem density) with those observed in PSPs indicated a good agreement over 30 years. Predictions of tree total volume and aboveground biomass were within the expected range for these plots. While the model is promising, future modifications are discussed."
e97c337f-ae26-47da-8650-12fecc663d17,1845/142924,"An integrated terrestrial ecosystem carbon-budget model based on changes in disturbance, climate, and atmospheric chemistry",2000-11-01,https://ostrnrcan-dostrncan.canada.ca/entities/publication/e97c337f-ae26-47da-8650-12fecc663d17,https://doi.org/10.1016/S0304-3800(00)00371-9,"Chen, W., Chen, J. & Cihlar, J. (2000). An integrated terrestrial ecosystem carbon-budget model based on changes in disturbance, climate, and atmospheric chemistry. <i>Ecological Modelling</i>, 135, 1, 55-79. https://doi.org/10.1016/S0304-3800(00)00371-9",Article,"Canada Centre for Remote Sensing","Elsevier BV",https://ostr-backend-prod.azurewebsites.net/server/api/core/items/e97c337f-ae26-47da-8650-12fecc663d17,"Chen, W.; Chen, J.; Cihlar, J.",English,,1,,,,,,,"ENVELOPE(-141.0000,  -50.0000,   90.0000,   41.7500)","POLYGON((41.7500 -83.0000, 49.0000 -95.0000, 49.0000 -122.0000, 48.0000 -124.0000, 52.0000 -132.0000, 60.0000 -141.0000, 90.0000 -141.0000, 82.0000 -60.0000, 78.0000 -74.0000, 46.0000 -50.0000, 43.0000 -60.0000, 41.7500 -83.0000))",,,"Disturbances (e.g. fire, insect-induced mortality, and harvest) and management practices (e.g. planting) affect the forest carbon (C) cycle, so do non-disturbance climatic and atmospheric factors (e.g. growing season length and temperature, abiotic decomposition factor,annual precipitation, atmospheric CO2 concentration, and nitrogen (N) deposition). Previous studies investigated the effects of these factors individually or in some combinations, but not their integrated effects at regional and global scales. This study describes an Integrated Terrestrial EcosystemC-budget model (InTEC), which integrates effects of all these factors on the annual C cycle of a forest region. InTEC is based on the Farquhar's leaf photosynthesis model, the Century C cycle model, the net N mineralization model of Townsend et al. [Ecol. Appl., 6 (1996) 806] and an age-NPPrelationship derived from forestry inventory-based age-biomass relationships. To integrate these existing models, which were developed for different purposes and had different spatial and temporal scales, into a coherent mechanistic model, we (1) develop a spatial and temporal up-scaling algorithmto use the instantaneous leaf-level model for a region at annual time step; and then (2) combine the upscaled results with an age-NPP relationship to obtain the annual NPP of a forest region. A historical change approach is then used to describe the regional annual C cycle, which not only improvesthe accuracy of its historical and present estimates, but also enables us to predict its future responses, both of which are critical in formulating mitigation and adaptation strategies for global changes. Applying InTEC to Canada's forests, we first investigate the impacts of each factor on the Ccycle over the short term (i.e. in the year of perturbation) and the long term (i.e. in the years after perturbation). The short-term and long-term effects are determined by changing one of the 10 factors in year 1 since the industrialization while keeping this factor in all other years and allother factors in all years at pre-industrial levels. Integrating all these short-term and long-term effects for the actual historical data of the 10 external forcing factors, we then estimate that the annual mean NBP (= NPP - soil respiration - fire emission - forest praoducts oxidation) of Canada'sforests was 40 ± 20 Tg C per year (i.e. a sink) in 1810s, reduced to - 131 ± 66 Tg C per year (i.e. a source) in 1870s, increased thereafter to a maximum of 200 ± 100 Tg C per year in 1930s, and decreased again to 57 ± 27 Tg C per year in 1990s. From 1800 to 1998, the aboveground biomass of Canada'sforests increased by ~19%, while the soil C stock increased by ~2%."
78a3b484-0cd6-485d-aeaf-eb9139fb03e4,1845/229773,"L’impact potentiel des ravageurs forestiers exotiques en Amerique du Nord : synthèse de la recherche",2000,https://ostrnrcan-dostrncan.canada.ca/entities/publication/78a3b484-0cd6-485d-aeaf-eb9139fb03e4,,"Krcmar-nozic, E.; Wilson, W.R.; Arthur, L. 2000. L’impact potentiel des ravageurs forestiers exotiques en Amerique du Nord : synthèse de la recherche. Natural Resources Canada, Canadian Forest Service, Pacific Forestry Centre, Victoria, BC. Rapport d'information BC-X-387F. 35 p.",Report,"Pacific Forestry Centre",,https://ostr-backend-prod.azurewebsites.net/server/api/core/items/78a3b484-0cd6-485d-aeaf-eb9139fb03e4,"Krcmar-nozic, E.; Wilson, W. R.; Arthur, L.",English,open,1,,0-662-85065-3,,,,,,,,,"Exotic pests are defined as flora and fauna species extending beyond their natural range of potential dispersal, that are having a combination of negative economic, ecological or social impacts. The steps involved in an exotic invasion are introduction, establishment and spread. Not all exotic species that successfully establish and spread are pests. Indeed, exotics are an integral component of the North American economy and ecology; over 90 percent of North American food and feed production is derived from intentionally introduced exotic species. The probability of an exotic species becoming a pest is quite low.  Successful establishment of an introduced organism into non-native habitat depends upon a complex interaction of several factors, including size of the introduction, adaptability of the organism, habitat suitability and the level of competition (predation, diseases, etc.). Although the likelihood of successful exotic spread is low, certain exotics that do become pests can have major negative impacts. It is estimated that over 300 tree-feeding insects native to Europe are now established in North America. A comprehensive US study estimates the total number of introduced species in the US exceeds 4542 and that 15 percent of these exotics cause severe harm in agriculture, forestry, industry, human health and to protected natural areas. The financial impact of alien forest pests in the US has been estimated at US$ 123 billion per year and annual timber losses at US$ 4 billion. While there are few impact studies in Canada, annual domestic timber losses to all forest pests (both exotic and indigenous) are an estimated 61 million m3 or about one-third of the total annual commercial harvest. Allowing that this timber would have been harvested, the annual financial loss to provincial stumpage, royalties, and rent revenues is about $720 million. Ecosystem impacts of exotic species include suppression and replacement of native species, potential for extirpation (e.g., American elm, American chestnut), and the threat to rare and endangered species. Ecosystems of low diversity, such as the boreal forests, are relatively more susceptible to exotic invasion. Stressed and depleted forests afford reduced food and habitat for wildlife, and have altered forest fundamentals which are manifested in nutrient cycle impacts, forest hydrology and forest fire regimes. The social effects of exotic pests can include impacts on human health, government credibility,  losses in aesthetic and spiritual values, public perception and support of forestry, employment and community stability, and international relations. The magnitude and nature of international trade directly affect trends in exotic pests. The increase in trade volumes and the emergence of new trading partners serve to increase the risk of exotic transmission. This risk is further strengthened by the speed of modern transportation, the use of containers, point-to-point delivery with inter-modal transport, and the use of “green” packaging materials. Travel, another source of trade and exotic introductions, has expanded dramatically and now includes many previously isolated regions. Any importation of living or untreated material (water, soil, air, wood, people, etc.) constitutes a potential source for the introduction of exotic pests. Canada is particularly vulnerable to trade transmissions of potential exotic pests because the US, our major trading partner, is also the world’s largest importer. The risk is further compounded by a degree of ecosystem integration between the two countries. Exotic pests can and do produce situations in which export opportunities are threatened and lost. The control/eradication options for exotic pests are increasingly being limited or eliminated in response to improved information on efficacy, collateral damage to other organisms and the degree of public acceptance. The range of options includes baits and attractants, fumigants, repellants and barriers, traps, poisons, biological agents, bounties and commercial exploitation, and mechanical removal. Given increased incidence of exotic pests, the magnitude of the expected damages and the limitation on control options, central to the control of exotic pests is an effective international effort to reduce the transmission risk at the source of introduction. This will require international cooperation, funding to support the required implementation in emerging exporters, monitoring provisions and established penalties for violations. Canada has a number of natural barriers to domestic spread of exotic pests. These include climate, distances and topographical barriers. It is important that the institutional structure be reviewed to ensure that it is positioned to complement these natural barriers."
c9ee5f22-4608-446d-a26f-eb89d3d51abd,1845/274663,"Carbon offset potentials of four alternative forest management strategies in Canada: A simulation study",2000-01-01,https://ostrnrcan-dostrncan.canada.ca/entities/publication/c9ee5f22-4608-446d-a26f-eb89d3d51abd,https://doi.org/10.1023/A:1009671422344,"(2000). Carbon offset potentials of four alternative forest management strategies in Canada: A simulation study. 5, 2, 143-169. https://doi.org/10.1023/A:1009671422344",Article,"Canada Centre for Remote Sensing","Springer Nature",https://ostr-backend-prod.azurewebsites.net/server/api/core/items/c9ee5f22-4608-446d-a26f-eb89d3d51abd,,English,,1,,,,,,,,,,,"Using an Integrated Terrestrial Ecosystem C-budget model (InTEC), we simulated the carbon (C) offset potentials of four alternative forest management strategies in Canada: afforestation, reforestation, nitrogen (N) fertilization, and substitution of fossil fuel with wood,under different climatic and disturbance scenarios. C offset potential is defined as additional C uptake by forest ecosystems or reduced fossil C emissions when a strategy is implemented to the theoretical maximum possible extent. The simulations provided the following estimated gains frommanagement: (1) Afforesting all the estimated 7.2 Mha of marginal agricultural land and urban areas in 1999 would create an average C offset potential of 8 Tg C y-1 during 1999-2100, at a cost of 3.4 Tg fossil C emission in 1999. (2) Prompt reforestation of all forest lands disturbed in the previousyear during 1999-2100 would produce an average C offset potential of 57 Tg C y-1 for this period, at a cost of 1.33 Tg C y-1. (3) Application of N fertilization (at the low rate of 5 kg N ha-1 y-1) to the 125 Mha of semi-mature forest during 1999-2100 would create an average C offset of 58 Tg C y-1for this period, at a cost of 0.24 Tg C y-1. (4) Increasing forest harvesting by 20% above current average rates during 1999-2100, and using the extra wood products to substitute for fossil energy would reduce average emissions by 11 Tg C y-1, at a cost of 0.54 Tg C y-1. If implemented to themaximum extent, the combined C offset potential of all four strategies would be 2-7 times the GHG emission reductions projected for the National Action Plan for Climate Change (NAPCC) initiatives during 2000-2020, and an order of magnitude larger than the projected increase in C uptake by Canada'sagricultural soils due to improved agricultural practices during 2000-2010."
5d443bec-be49-439e-ad82-bea8a732e21a,1845/256722,"Spatial Distribution of Carbon Sinks and Sources in Canada's Forests Based on Remote Sensing, Climate, Inventory and Tower Flux Data",2000,https://ostrnrcan-dostrncan.canada.ca/entities/publication/5d443bec-be49-439e-ad82-bea8a732e21a,,"Chen, J. M., Chen, W., Liu, J., Cihlar, J., Ou, Y., Pavlic, G., Price, D. T., Amiro, B. D., Frofymow, T., Black, T. A. & McCaughey, H. (2000). Spatial Distribution of Carbon Sinks and Sources in Canada's Forests Based on Remote Sensing, Climate, Inventory and Tower Flux Data. In <i>International Science Conference: The Role of Boreal Forests and Forestry in the Global Carbon Budge, Edmonton, Alberta, Canada, 8-12 May</i>. ","Book Chapter","Canada Centre for Remote Sensing",,https://ostr-backend-prod.azurewebsites.net/server/api/core/items/5d443bec-be49-439e-ad82-bea8a732e21a,"Chen, J. M.; Chen, W.; Liu, J.; Cihlar, J.; Ou, Y.; Pavlic, G.; Price, D. T.; Amiro, B. D.; Frofymow, T.; Black, T. A.; McCaughey, H.",English,,1,,,,,,,,,,,"In order to determine the role of Canada's forests in the global carbon balance, it is necessary to map the spatial distribution of carbon sinks and sources and to understand their temporal dynamics. To this end, we will provide an overview of our methods for mapping leafarea index (LAI), landcover, net primary productivity (NPP), fire scar age, and net ecosystem productivity (NEP) using satellite, climate, inventory and tower flux data. An optical instrument recently developed at CCRS has become a new international standard for ground-based measurements of LAI. Aprocess-based daily canopy NPP model with sunlit/shaded leaf separation was validated using two-level CO2 tower flux data. This new model avoids problems of widely-used big-leaf models for regional applications. Spatial forestry inventory data were co-registered with images from the VEGETATIONsensor, and an algorithm for detecting fire scar age up to 50 years was developed. An Integrated Terrestrial Ecosystem Carbon Budget Model (InTEC) was developed to describe the long-term effects of disturbance (fire, insect, harvest) and non-disturbance (climate warming, CO2 concentration, Ndeposition) on forest carbon cycle and to simulate post-disturbance dynamics of various carbon pools in vegetation and soil. The NPP-age relationship derived from InTEC was validated using inventory data. In mapping NEP, gridded half degree climate data for the last 100 years were bi-linearlyinterpolated to each pixel at 1 km resolution, and NPP in 1994 and stand age information were used. A 1200 km x 1200 km NEP map covering most of Saskatchewan and Manitoba was compared against the tower flux data acquired in 1994-1996 during Boreal Ecosystem-Atmospheric Study (BOREAS). Using the samemethodology, Canada-wide NEP maps were produced, showing south-north gradients in the sink/source strength in addition to large spatial variability. These maps are to be validated using tower flux and soil respiration data currently being acquired in different regions of Canada. Problems, new datarequirements and directions for improvement will be discussed."
925dad8d-7396-471e-aab4-3062227a713d,1845/230114,"The potential impacts of exotic forest pests in North America: a synthesis of research.",2000,https://ostrnrcan-dostrncan.canada.ca/entities/publication/925dad8d-7396-471e-aab4-3062227a713d,,"Krcmar-nozic, E.; Wilson, W.R.; Arthur, L. 2000. The potential impacts of exotic forest pests in North America: a synthesis of research. Natural Resources Canada, Canadian Forest Service, Pacific Forestry Centre, Victoria, BC. Information Report BC-X-387.",Report,"Pacific Forestry Centre",,https://ostr-backend-prod.azurewebsites.net/server/api/core/items/925dad8d-7396-471e-aab4-3062227a713d,"Krcmar-nozic, E.; Wilson, W. R.; Arthur, L.",English,open,1,,0-662-29385-1,,,,,,,,,"Exotic pests are defined as flora and fauna species extending beyond their natural range of potential dispersal, that are having a combination of negative economic, ecological or social impacts. The steps involved in an exotic invasion are introduction, establishment and spread. Not all exotic species that successfully establish and spread are pests. Indeed, exotics are an integral component of the North American economy and ecology; over 90 percent of North American food and feed production is derived from intentionally introduced exotic species. The probability of an exotic species becoming a pest is quite low.  Successful establishment of an introduced organism into non-native habitat depends upon a complex interaction of several factors, including size of the introduction, adaptability of the organism, habitat suitability and the level of competition (predation, diseases, etc.). Although the likelihood of successful exotic spread is low, certain exotics that do become pests can have major negative impacts. It is estimated that over 300 tree-feeding insects native to Europe are now established in North America. A comprehensive US study estimates the total number of introduced species in the US exceeds 4542 and that 15 percent of these exotics cause severe harm in agriculture, forestry, industry, human health and to protected natural areas. The financial impact of alien forest pests in the US has been estimated at US$ 123 billion per year and annual timber losses at US$ 4 billion. While there are few impact studies in Canada, annual domestic timber losses to all forest pests (both exotic and indigenous) are an estimated 61 million m3 or about one-third of the total annual commercial harvest. Allowing that this timber would have been harvested, the annual financial loss to provincial stumpage, royalties, and rent revenues is about $720 million. Ecosystem impacts of exotic species include suppression and replacement of native species, potential for extirpation (e.g., American elm, American chestnut), and the threat to rare and endangered species. Ecosystems of low diversity, such as the boreal forests, are relatively more susceptible to exotic invasion. Stressed and depleted forests afford reduced food and habitat for wildlife, and have altered forest fundamentals which are manifested in nutrient cycle impacts, forest hydrology and forest fire regimes. The social effects of exotic pests can include impacts on human health, government credibility,  losses in aesthetic and spiritual values, public perception and support of forestry, employment and community stability, and international relations. The magnitude and nature of international trade directly affect trends in exotic pests. The increase in trade volumes and the emergence of new trading partners serve to increase the risk of exotic transmission. This risk is further strengthened by the speed of modern transportation, the use of containers, point-to-point delivery with inter-modal transport, and the use of “green” packaging materials. Travel, another source of trade and exotic introductions, has expanded dramatically and now includes many previously isolated regions. Any importation of living or untreated material (water, soil, air, wood, people, etc.) constitutes a potential source for the introduction of exotic pests. Canada is particularly vulnerable to trade transmissions of potential exotic pests because the US, our major trading partner, is also the world’s largest importer. The risk is further compounded by a degree of ecosystem integration between the two countries. Exotic pests can and do produce situations in which export opportunities are threatened and lost. The control/eradication options for exotic pests are increasingly being limited or eliminated in response to improved information on efficacy, collateral damage to other organisms and the degree of public acceptance. The range of options includes baits and attractants, fumigants, repellants and barriers, traps, poisons, biological agents, bounties and commercial exploitation, and mechanical removal. Given increased incidence of exotic pests, the magnitude of the expected damages and the limitation on control options, central to the control of exotic pests is an effective international effort to reduce the transmission risk at the source of introduction. This will require international cooperation, funding to support the required implementation in emerging exporters, monitoring provisions and established penalties for violations. Canada has a number of natural barriers to domestic spread of exotic pests. These include climate, distances and topographical barriers. It is important that the institutional structure be reviewed to ensure that it is positioned to complement these natural barriers."
